{
  "constraint_set_id": "cset_5e21191f4718b9523ecd",
  "contract_version": "1.0.0",
  "company_id": "company_demo",
  "decision_subject_id": "subject_schedule_job",
  "constraints": [
    {
      "constraint_id": "constraint_company_boundary",
      "category": "company_boundary",
      "name": "Company boundary",
      "hardness": "hard",
      "operator": "eq",
      "subject_path": "company_id",
      "expected": "company_demo",
      "severity": "critical",
      "weight": 1,
      "provenance": [
        {
          "source_type": "trusted_company_context",
          "source_ref": "trusted_company_context",
          "captured_at": null,
          "confidence": 1.0
        }
      ],
      "authority": {
        "can_relax": false,
        "can_override": false,
        "required_authority_refs": []
      },
      "enabled": true,
      "description": "",
      "unit": null,
      "valid_from": null,
      "valid_until": null,
      "jurisdiction": null,
      "source_policy_ref": null,
      "metadata": {}
    },
    {
      "constraint_id": "permission_dispatch",
      "category": "permission",
      "name": "Dispatch permission required",
      "hardness": "hard",
      "operator": "contains",
      "subject_path": "actor.permissions",
      "expected": "jobs.dispatch",
      "severity": "high",
      "provenance": [
        {
          "source_type": "permission_registry",
          "source_ref": "perm.jobs.dispatch",
          "captured_at": "2026-09-03T00:00:00Z",
          "confidence": 1.0
        }
      ],
      "authority": {
        "can_relax": false,
        "can_override": false,
        "required_authority_refs": [
          "permission_registry"
        ]
      },
      "description": "",
      "unit": null,
      "weight": 1.0,
      "valid_from": null,
      "valid_until": null,
      "jurisdiction": null,
      "source_policy_ref": null,
      "enabled": true,
      "metadata": {}
    },
    {
      "constraint_id": "budget_cap",
      "category": "budget",
      "name": "Stay within approved budget",
      "hardness": "hard",
      "operator": "lte",
      "subject_path": "option.cost",
      "expected": 5000,
      "unit": "AUD",
      "severity": "high",
      "provenance": [
        {
          "source_type": "approved_budget",
          "source_ref": "budget_2026_q3",
          "captured_at": "2026-09-03T00:00:00Z",
          "confidence": 1.0
        }
      ],
      "authority": {
        "can_relax": true,
        "can_override": true,
        "required_authority_refs": [
          "budget_owner"
        ]
      },
      "description": "",
      "weight": 1.0,
      "valid_from": null,
      "valid_until": null,
      "jurisdiction": null,
      "source_policy_ref": null,
      "enabled": true,
      "metadata": {}
    },
    {
      "constraint_id": "deadline",
      "category": "deadline",
      "name": "Complete before deadline",
      "hardness": "hard",
      "operator": "before",
      "subject_path": "option.completion_at",
      "expected": "2026-09-10T17:00:00Z",
      "severity": "high",
      "provenance": [
        {
          "source_type": "task",
          "source_ref": "job_42_deadline",
          "captured_at": "2026-09-03T00:00:00Z",
          "confidence": 1.0
        }
      ],
      "authority": {
        "can_relax": true,
        "can_override": true,
        "required_authority_refs": [
          "job_owner"
        ]
      },
      "description": "",
      "unit": null,
      "weight": 1.0,
      "valid_from": null,
      "valid_until": null,
      "jurisdiction": null,
      "source_policy_ref": null,
      "enabled": true,
      "metadata": {}
    },
    {
      "constraint_id": "availability",
      "category": "availability",
      "name": "Required resource available",
      "hardness": "hard",
      "operator": "eq",
      "subject_path": "resource.available",
      "expected": true,
      "severity": "medium",
      "provenance": [
        {
          "source_type": "resource_registry",
          "source_ref": "resource_17",
          "captured_at": "2026-09-03T00:00:00Z",
          "confidence": 0.95
        }
      ],
      "authority": {
        "can_relax": false,
        "can_override": false,
        "required_authority_refs": []
      },
      "description": "",
      "unit": null,
      "weight": 1.0,
      "valid_from": null,
      "valid_until": null,
      "jurisdiction": null,
      "source_policy_ref": null,
      "enabled": true,
      "metadata": {}
    },
    {
      "constraint_id": "jurisdiction",
      "category": "jurisdiction",
      "name": "Correct jurisdiction",
      "hardness": "hard",
      "operator": "in",
      "subject_path": "location.jurisdiction",
      "expected": [
        "AU-VIC"
      ],
      "severity": "critical",
      "provenance": [
        {
          "source_type": "jurisdiction_resolver",
          "source_ref": "site_44",
          "captured_at": "2026-09-03T00:00:00Z",
          "confidence": 0.99
        }
      ],
      "authority": {
        "can_relax": false,
        "can_override": false,
        "required_authority_refs": [
          "legal_policy"
        ]
      },
      "description": "",
      "unit": null,
      "weight": 1.0,
      "valid_from": null,
      "valid_until": null,
      "jurisdiction": null,
      "source_policy_ref": null,
      "enabled": true,
      "metadata": {}
    },
    {
      "constraint_id": "policy_mfa",
      "category": "policy",
      "name": "MFA policy satisfied",
      "hardness": "hard",
      "operator": "eq",
      "subject_path": "actor.mfa_verified",
      "expected": true,
      "severity": "critical",
      "source_policy_ref": "policy.security.mfa",
      "provenance": [
        {
          "source_type": "company_policy",
          "source_ref": "policy.security.mfa",
          "captured_at": "2026-09-03T00:00:00Z",
          "confidence": 1.0
        }
      ],
      "authority": {
        "can_relax": false,
        "can_override": false,
        "required_authority_refs": [
          "policy_owner"
        ]
      },
      "description": "",
      "unit": null,
      "weight": 1.0,
      "valid_from": null,
      "valid_until": null,
      "jurisdiction": null,
      "enabled": true,
      "metadata": {}
    },
    {
      "constraint_id": "environment_water",
      "category": "environmental",
      "name": "Prefer lower water use",
      "hardness": "soft",
      "operator": "lte",
      "subject_path": "option.water_litres",
      "expected": 1000,
      "unit": "L",
      "severity": "medium",
      "weight": 0.8,
      "provenance": [
        {
          "source_type": "environmental_objective",
          "source_ref": "obj_environmental",
          "captured_at": "2026-09-03T00:00:00Z",
          "confidence": 0.9
        }
      ],
      "authority": {
        "can_relax": true,
        "can_override": true,
        "required_authority_refs": []
      },
      "description": "",
      "valid_from": null,
      "valid_until": null,
      "jurisdiction": null,
      "source_policy_ref": null,
      "enabled": true,
      "metadata": {}
    },
    {
      "constraint_id": "safety_rating",
      "category": "safety",
      "name": "Safety control must pass",
      "hardness": "hard",
      "operator": "eq",
      "subject_path": "safety.controls_passed",
      "expected": true,
      "severity": "critical",
      "provenance": [
        {
          "source_type": "safety_policy",
          "source_ref": "safe_work_method",
          "captured_at": "2026-09-03T00:00:00Z",
          "confidence": 1.0
        }
      ],
      "authority": {
        "can_relax": false,
        "can_override": false,
        "required_authority_refs": [
          "safety_authority"
        ]
      },
      "description": "",
      "unit": null,
      "weight": 1.0,
      "valid_from": null,
      "valid_until": null,
      "jurisdiction": null,
      "source_policy_ref": null,
      "enabled": true,
      "metadata": {}
    },
    {
      "constraint_id": "privacy_minimum",
      "category": "privacy",
      "name": "Privacy classification allowed",
      "hardness": "hard",
      "operator": "in",
      "subject_path": "data.privacy_class",
      "expected": [
        "public",
        "internal"
      ],
      "severity": "critical",
      "provenance": [
        {
          "source_type": "privacy_policy",
          "source_ref": "privacy.data.classes",
          "captured_at": "2026-09-03T00:00:00Z",
          "confidence": 1.0
        }
      ],
      "authority": {
        "can_relax": false,
        "can_override": false,
        "required_authority_refs": [
          "privacy_policy"
        ]
      },
      "description": "",
      "unit": null,
      "weight": 1.0,
      "valid_from": null,
      "valid_until": null,
      "jurisdiction": null,
      "source_policy_ref": null,
      "enabled": true,
      "metadata": {}
    },
    {
      "constraint_id": "capability",
      "category": "capability",
      "name": "Provider capability exists",
      "hardness": "hard",
      "operator": "contains",
      "subject_path": "provider.capabilities",
      "expected": "work.schedule",
      "severity": "high",
      "provenance": [
        {
          "source_type": "capability_registry",
          "source_ref": "provider_scheduler",
          "captured_at": "2026-09-03T00:00:00Z",
          "confidence": 1.0
        }
      ],
      "authority": {
        "can_relax": false,
        "can_override": false,
        "required_authority_refs": [
          "capability_registry"
        ]
      },
      "description": "",
      "unit": null,
      "weight": 1.0,
      "valid_from": null,
      "valid_until": null,
      "jurisdiction": null,
      "source_policy_ref": null,
      "enabled": true,
      "metadata": {}
    },
    {
      "constraint_id": "entitlement",
      "category": "entitlement",
      "name": "Company entitlement active",